{
  "schema_version": "1.0",
  "artifact_type": "workflow_impact_scoreboard",
  "scoreboard_id": "fairy-tale-workflow-impact-sample",
  "generated_at_utc": "2026-07-17T00:00:00Z",
  "source_refs": [
    {
      "source_id": "claude-skill-eval-guidance",
      "url": "https://code.claude.com/docs/en/skills",
      "checked_at": "2026-07-17",
      "source_type": "official",
      "evidence_kind": "context",
      "artifact_path": null,
      "artifact_sha256": null,
      "note": "Official skill evaluation guidance: isolate each case in a fresh session, compare with-skill and without-skill conditions, and record pass rate, duration, and tokens."
    },
    {
      "source_id": "benchmark-validation-plan",
      "url": "https://github.com/bonginkan/fairy_tale/blob/main/docs/benchmark-validation-plan.md",
      "checked_at": "2026-07-17",
      "source_type": "repository",
      "evidence_kind": "context",
      "artifact_path": null,
      "artifact_sha256": null,
      "note": "Repository comparison contract for model, prompt, scorer, budget, retries, and safety parity."
    },
    {
      "source_id": "feedback-governance",
      "url": "https://github.com/bonginkan/fairy_tale/blob/main/docs/feedback-governance.md",
      "checked_at": "2026-07-17",
      "source_type": "repository",
      "evidence_kind": "context",
      "artifact_path": null,
      "artifact_sha256": null,
      "note": "Measured outcomes and regressions govern feedback promotion and pruning."
    },
    {
      "source_id": "example-benchmark-baseline-artifact",
      "url": "https://github.com/bonginkan/fairy_tale/blob/main/examples/workflow-scoreboard/benchmark-baseline.json",
      "checked_at": "2026-07-17",
      "source_type": "repository",
      "evidence_kind": "example_run",
      "artifact_path": "examples/workflow-scoreboard/benchmark-baseline.json",
      "artifact_sha256": "sha256:d9fff8cc261dd2ca837a6d9e145113d2a07be528830e62c08bb9b0a4e7cb9024",
      "note": "Immutable illustrative benchmark baseline artifact."
    },
    {
      "source_id": "example-benchmark-fairy-tale-artifact",
      "url": "https://github.com/bonginkan/fairy_tale/blob/main/examples/workflow-scoreboard/benchmark-fairy-tale.json",
      "checked_at": "2026-07-17",
      "source_type": "repository",
      "evidence_kind": "example_run",
      "artifact_path": "examples/workflow-scoreboard/benchmark-fairy-tale.json",
      "artifact_sha256": "sha256:856ed25bf0d43e4954df2b288a8aec4c48a0f74d25cd19dde0b40a061fa220bc",
      "note": "Immutable illustrative Fairy Tale benchmark artifact."
    },
    {
      "source_id": "example-normal-baseline-artifact",
      "url": "https://github.com/bonginkan/fairy_tale/blob/main/examples/workflow-scoreboard/normal-baseline.json",
      "checked_at": "2026-07-17",
      "source_type": "repository",
      "evidence_kind": "example_run",
      "artifact_path": "examples/workflow-scoreboard/normal-baseline.json",
      "artifact_sha256": "sha256:763334e621eb3fb3bf723a91628a4c33190eadc344f78fe45194e5ba9f9140f9",
      "note": "Immutable illustrative normal-task baseline artifact."
    },
    {
      "source_id": "example-normal-fairy-tale-artifact",
      "url": "https://github.com/bonginkan/fairy_tale/blob/main/examples/workflow-scoreboard/normal-fairy-tale.json",
      "checked_at": "2026-07-17",
      "source_type": "repository",
      "evidence_kind": "example_run",
      "artifact_path": "examples/workflow-scoreboard/normal-fairy-tale.json",
      "artifact_sha256": "sha256:38ea9355396897680d6187319d5114014263e209211e840c3cab44a3708ad0f4",
      "note": "Immutable illustrative Fairy Tale normal-task artifact."
    },
    {
      "source_id": "routing-eval-20260702-artifact",
      "url": "https://github.com/bonginkan/fairy_tale/blob/main/docs/skill-budget/routing-eval-20260702.json",
      "checked_at": "2026-07-17",
      "source_type": "repository",
      "evidence_kind": "measured_run",
      "artifact_path": "docs/skill-budget/routing-eval-20260702.json",
      "artifact_sha256": "sha256:fe2bd35b7c57958848480ee2215975fa3d9cb62c715f874db3b79bb9f4e92905",
      "note": "Measured routing-evaluation ledger consumed by the scoreboard parity gate."
    }
  ],
  "entries": [
    {
      "entry_id": "example-benchmark-pair",
      "task_kind": "benchmark",
      "task_family": "illustrative closed benchmark",
      "task_id": "benchmark-example-01",
      "comparison_mode": "paired_local",
      "comparison_contract": {
        "model": "example-model",
        "effort": "example-medium",
        "prompt_version": "example-prompt-v1",
        "scorer_version": "example-scorer-v1",
        "sample_ids": ["sample-a", "sample-b"],
        "max_output_tokens": 1024,
        "wall_clock_budget_seconds": 300,
        "tool_budget": 0,
        "budget_unavailable_reason": null,
        "retry_policy": "No retries.",
        "safety_policy": "Same benchmark safety policy in both conditions."
      },
      "runs": [
        {
          "run_id": "example-benchmark-baseline",
          "condition": "baseline",
          "source_kind": "example",
          "isolation": {
            "fresh_session": true,
            "skill_state": "disabled",
            "note": "Illustrative fresh session with Fairy Tale unavailable."
          },
          "metrics": {
            "pass_count": 1,
            "total_count": 2,
            "validation_result": "fail",
            "score": 0.5,
            "score_unit": "pass_rate",
            "score_unavailable_reason": null,
            "elapsed_seconds": 42.0,
            "elapsed_unavailable_reason": null,
            "cost_usd": 0.02,
            "cost_unavailable_reason": null,
            "tokens": {
              "input_tokens": 100,
              "output_tokens": 200,
              "cache_creation_input_tokens": 0,
              "cache_read_input_tokens": 0,
              "total_tokens": 300
            },
            "token_unavailable_reason": null
          },
          "regression": {
            "status": "unknown",
            "note": "Example-only baseline; no measured regression claim."
          },
          "artifact": {
            "kind": "example",
            "source_ref": "example-benchmark-baseline-artifact",
            "path": "examples/workflow-scoreboard/benchmark-baseline.json",
            "visibility": "repository",
            "disclosure": "full",
            "sha256": "sha256:d9fff8cc261dd2ca837a6d9e145113d2a07be528830e62c08bb9b0a4e7cb9024"
          },
          "card_telemetry": [],
          "validation_evidence": ["Illustrative artifact; excluded from measured aggregates by source_kind=example."]
        },
        {
          "run_id": "example-benchmark-fairy-tale",
          "condition": "fairy_tale",
          "source_kind": "example",
          "isolation": {
            "fresh_session": true,
            "skill_state": "enabled",
            "note": "Illustrative fresh session with the Fairy Tale skill available."
          },
          "metrics": {
            "pass_count": 2,
            "total_count": 2,
            "validation_result": "pass",
            "score": 1.0,
            "score_unit": "pass_rate",
            "score_unavailable_reason": null,
            "elapsed_seconds": 48.0,
            "elapsed_unavailable_reason": null,
            "cost_usd": 0.025,
            "cost_unavailable_reason": null,
            "tokens": {
              "input_tokens": 150,
              "output_tokens": 240,
              "cache_creation_input_tokens": 50,
              "cache_read_input_tokens": 0,
              "total_tokens": 440
            },
            "token_unavailable_reason": null
          },
          "regression": {
            "status": "none",
            "note": "Illustrative result only; no real benchmark claim."
          },
          "artifact": {
            "kind": "example",
            "source_ref": "example-benchmark-fairy-tale-artifact",
            "path": "examples/workflow-scoreboard/benchmark-fairy-tale.json",
            "visibility": "repository",
            "disclosure": "full",
            "sha256": "sha256:856ed25bf0d43e4954df2b288a8aec4c48a0f74d25cd19dde0b40a061fa220bc"
          },
          "card_telemetry": [
            {
              "card_path": "references/cards/benchmark-delta-harness.md",
              "fired_count": 1,
              "contribution": "helpful",
              "attributed_tokens": 140,
              "token_unavailable_reason": null,
              "evidence_refs": ["Illustrative card attribution for schema demonstration only."]
            }
          ],
          "validation_evidence": ["Illustrative artifact; excluded from measured aggregates by source_kind=example."]
        }
      ],
      "comparison_note": "Schema example only. The numbers are illustrative and are not a benchmark claim."
    },
    {
      "entry_id": "example-normal-pair",
      "task_kind": "normal",
      "task_family": "illustrative code review",
      "task_id": "normal-example-01",
      "comparison_mode": "paired_local",
      "comparison_contract": {
        "model": "example-model",
        "effort": "example-medium",
        "prompt_version": "example-review-prompt-v1",
        "scorer_version": "example-review-rubric-v1",
        "sample_ids": ["review-a"],
        "max_output_tokens": 1024,
        "wall_clock_budget_seconds": 180,
        "tool_budget": 5,
        "budget_unavailable_reason": null,
        "retry_policy": "No retries.",
        "safety_policy": "Read-only review in both conditions."
      },
      "runs": [
        {
          "run_id": "example-normal-baseline",
          "condition": "baseline",
          "source_kind": "example",
          "isolation": {
            "fresh_session": true,
            "skill_state": "disabled",
            "note": "Illustrative fresh review session without Fairy Tale."
          },
          "metrics": {
            "pass_count": 0,